{
  "$schema": "https://json-schema.org/draft/2020-12/schema",
  "$id": "https://example.local/types/timeline/v1/schema.json",
  "title": "Timeline v1",
  "description": "Toon een tijdlijn tussen een start- en einddatum met optionele momenten. Je kiest de richting (links→rechts of boven→beneden), een schaal (uur/dag/maand/kwartaal/jaar/2 jaar/3 jaar/4 jaar/5 jaar/decennium), optionele faseblokken, optionele jaar-knipsels en per moment een datum + titel + beschrijving (optioneel met afbeelding).",
  "supportsCompletion": false,
  "outputs": [],
  "type": "object",
  "required": ["unique_id", "direction", "scale", "startDate", "endDate"],
  "additionalProperties": false,
  "properties": {
    "unique_id": {
      "type": "string",
      "title": "Unieke ID",
      "description": "Unieke sleutel voor deze tool-instance. Wordt ook gebruikt als querystring-parameter in de iframe-URL (`?unique_id=...`).",
      "minLength": 1
    },
    "title": {
      "type": "string",
      "title": "Titel (optioneel)",
      "description": "Titel boven de tijdlijn. Laat leeg voor geen titel. Als ook 'Toon datums' uit staat, toont de tool de tijdlijn zonder buitenkader op de volledige iframe-afmeting."
    },
    "intro": {
      "type": "string",
      "title": "Intro (optioneel)",
      "description": "Korte uitleg die boven de tijdlijn wordt getoond."
    },
    "viewport": {
      "type": "object",
      "title": "Weergave (optioneel)",
      "description": "Optionele instellingen om de tijdlijn ruimer te maken (bijv. een minimale hoogte of breedte).",
      "additionalProperties": false,
      "properties": {
        "minWidthPx": {
          "type": "integer",
          "title": "Minimale breedte (px)",
          "description": "Zet een minimale breedte voor de tijdlijn. Handig voor lange tijdlijnen; bij een smaller scherm kan er horizontaal gescrold worden.",
          "minimum": 320,
          "maximum": 6000
        },
        "minHeightPx": {
          "type": "integer",
          "title": "Minimale hoogte (px)",
          "description": "Zet een minimale hoogte voor de tijdlijn, zodat momenten meer ruimte krijgen.",
          "minimum": 240,
          "maximum": 6000
        }
      }
    },
    "direction": {
      "type": "string",
      "title": "Richting",
      "description": "In welke richting de tijdlijn loopt.",
      "enum": ["links-naar-rechts", "boven-naar-beneden"],
      "default": "links-naar-rechts"
    },
    "scale": {
      "type": "string",
      "title": "Schaal",
      "description": "Welke schaal de as/ticks gebruikt.",
      "enum": ["uur", "dag", "maand", "kwartaal", "jaar", "2 jaar", "3 jaar", "4 jaar", "5 jaar", "decennium"],
      "default": "jaar"
    },
    "showDates": {
      "type": "boolean",
      "title": "Toon datums",
      "description": "Toon de periode en schaal bovenaan, de datumlabels op de as en de datum bij elk moment. Zet uit voor een overzicht met bijvoorbeeld alleen projectfasen.",
      "default": true
    },
    "startDate": {
      "title": "Startdatum",
      "description": "Start van de tijdlijn. Je mag een datum (YYYY-MM-DD) of een datum+tijd (ISO 8601 date-time) gebruiken.",
      "anyOf": [
        { "type": "string", "format": "date" },
        { "type": "string", "format": "date-time" }
      ]
    },
    "endDate": {
      "title": "Einddatum",
      "description": "Einde van de tijdlijn. Je mag een datum (YYYY-MM-DD) of een datum+tijd (ISO 8601 date-time) gebruiken.",
      "anyOf": [
        { "type": "string", "format": "date" },
        { "type": "string", "format": "date-time" }
      ]
    },
    "yearCuts": {
      "type": "string",
      "title": "Jaren/periodes knippen (optioneel)",
      "description": "Lijst met jaren of jaar-ranges die uit de tijdas geknipt worden. Gebruik komma's, bijvoorbeeld: 1992-2000, 2009-2018, 2025, 2032.",
      "format": "textarea"
    },
    "phases": {
      "type": "array",
      "title": "Fasen (optioneel)",
      "description": "Optionele faseblokken die als gekleurde band achter de tijdlijn worden getoond, inclusief label.",
      "items": { "$ref": "#/$defs/phase" }
    },
    "events": {
      "type": "array",
      "title": "Momenten (optioneel)",
      "description": "De momenten op de tijdlijn. Laat leeg of weg als je alleen fasen wilt tonen.",
      "default": [],
      "items": { "$ref": "#/$defs/event" }
    }
  },
  "allOf": [
    {
      "if": { "properties": { "direction": { "const": "links-naar-rechts" } } },
      "then": {
        "properties": {
          "events": {
            "items": {
              "properties": {
                "placement": {
                  "enum": ["auto", "boven", "onder"]
                }
              }
            }
          }
        }
      }
    },
    {
      "if": { "properties": { "direction": { "const": "boven-naar-beneden" } } },
      "then": {
        "properties": {
          "events": {
            "items": {
              "properties": {
                "placement": {
                  "enum": ["auto", "links", "rechts"]
                }
              }
            }
          }
        }
      }
    }
  ],
  "$defs": {
    "phase": {
      "type": "object",
      "title": "Fase",
      "required": ["label", "startDate", "endDate"],
      "additionalProperties": false,
      "properties": {
        "label": {
          "type": "string",
          "title": "Label",
          "description": "Korte naam van de fase."
        },
        "description": {
          "type": "string",
          "title": "Beschrijving (optioneel)",
          "description": "Optionele extra uitleg; wordt gebruikt als tooltip.",
          "format": "textarea"
        },
        "startDate": {
          "title": "Startdatum",
          "description": "Begin van de fase. Je mag een datum (YYYY-MM-DD) of een datum+tijd (ISO 8601 date-time) gebruiken.",
          "anyOf": [
            { "type": "string", "format": "date" },
            { "type": "string", "format": "date-time" }
          ]
        },
        "endDate": {
          "title": "Einddatum",
          "description": "Einde van de fase. Je mag een datum (YYYY-MM-DD) of een datum+tijd (ISO 8601 date-time) gebruiken.",
          "anyOf": [
            { "type": "string", "format": "date" },
            { "type": "string", "format": "date-time" }
          ]
        },
        "color": {
          "type": "string",
          "title": "Kleur (optioneel)",
          "description": "CSS-kleur voor de faseband, bijvoorbeeld #d7def5 of rgba(31,111,94,0.18)."
        },
        "textColor": {
          "type": "string",
          "title": "Tekstkleur (optioneel)",
          "description": "CSS-kleur voor het faselabel."
        }
      }
    },
    "event": {
      "type": "object",
      "title": "Moment",
      "required": ["date", "title", "description"],
      "additionalProperties": false,
      "properties": {
        "date": {
          "title": "Datum",
          "description": "Datum van het moment. Je mag een datum (YYYY-MM-DD) of een datum+tijd (ISO 8601 date-time) gebruiken.",
          "anyOf": [
            { "type": "string", "format": "date" },
            { "type": "string", "format": "date-time" }
          ]
        },
        "title": {
          "type": "string",
          "title": "Titel",
          "description": "Korte titel voor dit moment."
        },
        "subtitle": {
          "type": "string",
          "title": "Ondertitel (optioneel)",
          "description": "Korte extra regel onder de titel (bijv. locatie, onderwerp of extra context)."
        },
        "description": {
          "type": "string",
          "title": "Beschrijving",
          "description": "Omschrijving van dit moment.",
          "format": "textarea"
        },
        "placement": {
          "type": "string",
          "title": "Plaatsing",
          "description": "Waar het moment t.o.v. de as komt. Bij links→rechts: boven/onder. Bij boven→beneden: links/rechts.",
          "default": "auto"
        },
        "cardStyle": {
          "type": "string",
          "title": "Kaartkleur (optioneel)",
          "description": "Kies een zacht kleurenpalet voor dit kaartje. Achtergrond, rand, tekst en marker krijgen dan automatisch een bijpassende schakering.",
          "enum": ["salie-groen", "licht-blauw", "zacht-perzik", "poeder-roze"]
        },
        "imageUrl": {
          "type": "string",
          "title": "Afbeelding (optioneel)",
          "description": "Kies een lokale cursusafbeelding die in het moment-card wordt getoond.",
          "format": "image"
        },
        "linkUrl": {
          "type": "string",
          "title": "Link (optioneel)",
          "description": "Als je dit invult, wordt het moment-card klikbaar en opent de link in een nieuw tabblad. Mag ook relatief zijn t.o.v. de data-URL.",
          "format": "uri-reference"
        }
      }
    }
  }
}
