{
  "unique_id": "demo-timeline-1",
  "title": "Tijdlijn: semesterplanning (voorbeeld)",
  "intro": "Voorbeeldtijdlijn met twee sporen, vaste links/rechts-plaatsing en optionele faseblokken.",
  "direction": "boven-naar-beneden",
  "scale": "maand",
  "startDate": "2026-08-01",
  "endDate": "2026-12-31",
  "phases": [
    {
      "label": "Fase 1 - Start",
      "startDate": "2026-08-25",
      "endDate": "2026-09-14",
      "color": "#f6d8a6",
      "textColor": "#6d4d0f"
    },
    {
      "label": "Fase 2 - Prototype",
      "startDate": "2026-09-15",
      "endDate": "2026-10-19",
      "color": "#cfe7d4",
      "textColor": "#1e5e3d"
    },
    {
      "label": "Fase 3 - Integratie",
      "startDate": "2026-10-20",
      "endDate": "2026-11-16",
      "color": "#d7def5",
      "textColor": "#294475"
    }
  ],
  "viewport": {
    "minHeightPx": 1400
  },
  "events": [
    {
      "date": "2026-08-25",
      "title": "Projectstart",
      "subtitle": "Projectlijn",
      "description": "Teams vormen, opdracht verkennen en de hoofdlijn neerzetten.",
      "placement": "links",
      "cardStyle": "licht-blauw"
    },
    {
      "date": "2026-08-25",
      "title": "Tooling en zelfonderzoek",
      "subtitle": "Ondersteunende lijn",
      "description": "Ondersteunende les die direct naast de projectstart wordt ingepland.",
      "placement": "rechts",
      "cardStyle": "zacht-perzik"
    },
    {
      "date": "2026-09-15",
      "title": "Eerste sprint",
      "subtitle": "Projectlijn",
      "description": "De eerste echte ontwikkelronde met een eerste prototypeversie.",
      "placement": "links",
      "cardStyle": "licht-blauw"
    },
    {
      "date": "2026-09-22",
      "title": "3D-ontwerp en elektronica",
      "subtitle": "Ondersteunende lijn",
      "description": "Technische verdieping sluit aan op wat in de sprint gebouwd wordt.",
      "placement": "rechts",
      "cardStyle": "zacht-perzik"
    },
    {
      "date": "2026-11-17",
      "title": "Afronding en oplevering",
      "subtitle": "Projectlijn",
      "description": "Integreren, stabiliseren en toewerken naar presentatie en oplevering.",
      "placement": "links",
      "cardStyle": "licht-blauw"
    }
  ]
}
